{
  "actor_context": {
    "actor_type": "USER",
    "principal_id": "018f1c2a-7b3d-7abc-8def-0123456789af"
  },
  "aggregate": {
    "aggregate_type": "Mission",
    "object_id": "018f1c2a-7b3d-7abc-8def-0123456789ae"
  },
  "aggregate_version": 1,
  "audit": {
    "integrity_digest": "0000000000000000000000000000000000000000000000000000000000000000",
    "provenance": "command:CreateMission"
  },
  "authority_epoch": 0,
  "correlation_id": "018f1c2a-7b3d-7abc-8def-0123456789b0",
  "event_id": "018f1c2a-7b3d-7abc-8def-0123456789b1",
  "event_type": "MissionCreated",
  "lifecycle_epoch": 0,
  "occurred_at": "2026-07-29T20:00:00.000000Z",
  "operation_id": "018f1c2a-7b3d-7abc-8def-0123456789ac",
  "organization_id": "018f1c2a-7b3d-7abc-8def-0123456789ad",
  "payload": {
    "mission_id": "018f1c2a-7b3d-7abc-8def-0123456789ae",
    "objective": "Establish an independently executable mission.",
    "owner_id": "018f1c2a-7b3d-7abc-8def-0123456789af",
    "settings": {}
  },
  "recorded_at": "2026-07-29T20:00:00.000001Z",
  "schema_version": 1,
  "vector_clock": {
    "replica-a": 2
  }
}
